"# Set up Gecko Driver on Ubuntu<br /><br />!(images/Screenshot from 2019-03-23 12-49-43.png)<br /><br />**Engineer Level: College Dropout (Intermediate)**<br /><br />Selenium Webdriver can be used to automate routine tasks and to perform regression tests.<br />Currently I build automations using Selenium Webdriver and Sikuli to automate routine daily tasks. Since I maintain multiple websites, I figured that I could use this same technology to perform the code updates on the websites that I manage.<br />Selenium Webdriver has some first time setup steps that have to be done in order for you to be able to build the automations.<br />My browser of choice is Firefox. Some people reading this will not be thrilled about that, but everyone has their preferences. If you like to use Chrome, or worse Internet Explorer, then the steps mentioned below are similar to those for Firefox. However this post focuses on setting up with Firefox.<br />First thing that you will need to do is to have Eclipse or similar IDE installed on your computer. That will not be covered in this post.<br />Next, download the Gecko Driver. That can be downloaded from <a href=""https://github.com/mozilla/geckodriver"">https://github.com/mozilla/geckodriver</a>. The Gecko Driver serves as a middle man between Webdriver and the web browser. The web browser cannot directly communicate or interact with the web browser. What happens is Webdriver interacts with the Gecko Driver. Then the Gecko Driver translates those interactions into actions that the browser can perform. Once the action is performed, then response is sent back from the browser to the Gecko Driver to Webdriver.<br />Next, create a Maven project. In the pom.xml file, you will need to add the following dependency to the file:<br />``` &lt;dependency&gt;<br>  &lt;groupId&gt;org.seleniumhq.selenium&lt;/groupId&gt;<br>  &lt;artifactId&gt;selenium-java&lt;/artifactId&gt;<br>  &lt;version&gt;3.14.0&lt;/version&gt;<br> &lt;/dependency&gt;```<br /><br />At the time of this writing, 3.14.0 version, was the second latest versoin that was available. I would recommend using the latest or later version that is available.<br />Next, add the Java code below to your main function. This is the simpliest code to get an automation running with Firefox.<br />```System.setProperty(""webdriver.gecko.driver"", ""/home/almostengineer/java-workspace/geckodriver""); // define geckodriver location<br>WebDriver driver = new FirefoxDriver(); // open browser<br>driver.get(""http://google.com""); // open the website of choice<br>Thread.sleep(5000); // allow results to be seen<br>driver.quit(); // close browser ```<br /><br />In the above, ""```/home/almostengineer/java-workspace/geckodriver```<br />"" will need to be replaced with the location that you have downloaded the Gecko Driver.<br />If you choose, you may also change the website that the browser opens.<br />Now you may run the application that you have built. If done correctly, you will see the browser open, then the Google home page appear, then the browser close. There may be some red text in the Java console, but there is no need to be alarmed by this unless there is an exception mentioned.<br />The code used here can be downloaded from my Github repository at <a target=""_blank"" href=""https://github.com/almostengr/seleniumtutorial"">https://github.com/almostengr/seleniumtutorial</a><br /><br /><br />The entire file Java file would look like the following:<br />```package com.thealmostengineer.seleniumtutorial;<br /><br />import org.openqa.selenium.WebDriver;<br />import org.openqa.selenium.firefox.FirefoxDriver;<br /><br />/**<br />* Hello world!<br />*<br />*/<br />public class App <br />{<br />   static void geckoDriverTest() throws Exception {<br />	System.setProperty(""webdriver.gecko.driver"", ""/home/almostengineer/java-workspace/geckodriver"");<br />       WebDriver driver = new FirefoxDriver(); // open browser<br />       driver.manage().window().maximize(); // maximize the browser window<br />       driver.get(""http://google.com"");<br />       Thread.sleep(5000); // allow results to be seen<br />       driver.quit(); // close browser<br />   }<br />	<br />   public static void main( String[] args )<br />   {<br />   	try {<br />		geckoDriverTest();<br />	} catch (Exception e) {<br />		// TODO Auto-generated catch block<br />		e.printStackTrace();<br />	}    	<br />   }<br />}<br />```<br /><br /><br />**Posted: 2019-04-05 23:44:59**<br /><br />**Updated: 2019-04-05 23:45:24**<br /><br />";"2019.04.05-set-up-gecko-driver-on-ubuntu.md"
"# Takeaways from Christopher Robin movie<br /><br />**Engineer Level: College Dropout (Intermediate)**<br /><br />Every year during the month of November, the church that I attend does a series where movies are used to provide examples and metaphors of the Word. This week's particular movie was ""Disney's Christopher Robin"". As I was in church, watching this message and movie, it spoke to me given the number of changes that were taking place in my life. <br /><br />SPOILER ALERT: I do mention scenes from the movie. So if you have not watched the movie yet and hate spoilers, go watch the movie before reading this article.  <br /><br />## Things That I Got From This Movie<br /><br />### Doing Nothing Often Leads To The Very Best Of Something<br /><br />Picture a tree in a forest. That tree seed landed on the ground and took root. Usually there’s nothing any human has to do as the tree will be able to sustain itself unless something else takes place like a natural disaster (flood, forest fire) or human intervention (land clearing, improper trimming of tree). By nobody doing anything to that tree, the tree is able to provide oxygen for mammals to breathe, habitat for the animals of the forest, and shade to the animals and humans that visit the forest.  This is a quote that is repeated many times in the movie. Majority of the movie, Christopher Robin spends time trying to work on making efficiency improvements for his employer. Then at the end of the movie, he took one look at the paper his daughter handed him upside down and he came up with the best idea for cutting company costs. Sometimes not doing or saying anything, causes God or others to intervene on our behalf. Think of this as not repaying evil with evil. <br /><br />### When You Get Lost, You Need To Reset<br /><br />There’s a song, called ""Holy Ghost Power"" by the Chicago Mass Choir. Part of the chorus of that song says ""Go back to the altar; Down on your knees; Stay there 'til you get the Holy Ghost power"". This is one example of resetting your faith. It is believed that if you go to the altar and pray, that you’ll be renewed and forgiven. Another example of this would be when you lose your keys and you backtrack your steps in order to find them.  In the movie, Pooh walked into the tree that Christopher Robin previously lived and ended up in London. Pooh was at this point lost because he did not know where he was. However, Christopher Robin did know where he was, so Christopher Robin took Pooh back to Sussex and onward to the Hundred Acre Wood. In essence, Pooh was reset. By resetting, you are able to go where things are familiar, look at the path that you previously took, and then start a new path knowing that the existing path led you to a bad result.<br /><br />### We Are Not Who We Used To Be. Sometimes We Become Lost<br /><br />The smartest of people make mistakes. We are all human. When a bridge failure or airplane malfunction occurs, often the maintainers and engineers get the blame. The investigators often go back to the original drawings and design to see if there were any miscalculations, typos, or other errors that were overlooked. Once those errors are identified, they are corrected so that they do not occur again. Whether it be redrawing the bridge or redesigning a component of the plane, it has now become better and it is not what it used to be. In the movie, this was reflected by Christopher Robin going back to the Hundred Acre Wood. Once there and Christopher Robin had to show the other inhabitants of the Hundred Acre Wood that he was indeed Christopher Robin as they last remembered him being a young boy and not a man. I like to refer to this as ""growth and development"". <br /><br />### Find What Makes You Happy<br /><br />In the movie, Christopher Robin and Pooh are at the train station trying to catch the train to take Pooh back home. Pooh sees a balloon stand and says that he wants a balloon. Christopher initially says no but then gives in after Pooh mentions that the balloon will bring him happiness. Getting big things and dreams accomplished do bring us happiness, but sometimes it is the small things that can bring us the most happiness. For me, that would mean being in the presence of others, also known as quality time, that brings the greatest amount of happiness. <br /><br />## Conclusion <br /><br />Everything happens for a reason.  For me, it felt like perfect timing as these takeaway points and more are steps that I need to take to go forward in life. <br /><br /><br />**Posted: 2019-11-24 20:26:49**<br /><br />**Updated: 2019-11-24 20:29:56**<br /><br />";"2019.11.24-takeaways-from-christopher-robin-movie.md"
"# Run Drupal Cron via Bash with Drush<br /><br />**Engineer Level: Amateur (Beginner)**<br /><br />```<br />date<br /><br />DRUPALHOME=/path/to/drupal/site<br /><br />cd $DRUPALHOME<br /><br />drush cron<br /><br />date<br />```<br /><br /><br />**Posted: 2016-02-04 09:42:29**<br /><br />**Updated: 2019-05-05 11:59:46**<br /><br />";"2016.02.04-run-drupal-cron-via-bash-with-drush.md"
"# Automating Ubuntu 14.04 Automatic Updates<br /><br />**Engineer Level: Amateur (Beginner)**<br /><br />```sudo dpkg-reconfigure unattended-upgrades```<br /><br /><br />If you receive an error stating that unattended-upgrades package cannot be found, then run the command below. Otherwise skip to the next section. <br /><br />```<br />sudo apt-get update<br />sudo apt-get install -y unattended-upgrades<br />```<br /><br /><br />The command above will install (or reinstall) the package and any other required dependencies. <br /><br />To change the time that updates run, you'll need to update the crontab for this job.  Run the command <br />```sudo vi /etc/crontab```<br /><br /><br />Find the line that contains<br />```15 6    * * *   root    test -x /usr/sbin/anacron || ( cd / && run-parts --report /etc/cron.daily )```<br /><br />and change it to <br />```15 2    * * *   root    test -x /usr/sbin/anacron || ( cd / && run-parts --report /etc/cron.daily )```<br /><br />Then save the crontab file and exit.<br /><br />If you want to view the automatic update history, you can view the Unattended Upgrades log file by going to the log directory ```cd /var/log/unattended-upgrades/```<br />.  Here you will have the log files for the updates that were performed.<br />```<br />root@pbook:/var/log/unattended-upgrades# ls<br />unattended-upgrades-dpkg_2016-02-23_06:53:08.139255.log  unattended-upgrades-dpkg_2016-03-02_06:45:32.549847.log  unattended-upgrades.log<br />unattended-upgrades-dpkg_2016-02-25_06:37:04.235617.log  unattended-upgrades-dpkg_2016-03-03_06:51:24.794181.log  unattended-upgrades.log.1.gz<br />unattended-upgrades-dpkg_2016-02-27_06:47:23.014962.log  unattended-upgrades-dpkg_2016-03-10_06:44:05.855211.log  unattended-upgrades-shutdown.log<br />```<br /><br /><br />Additional options related to the Unattended Upgrades including automatic reboot and sending email notifications can be found in <br />/etc/apt/apt.conf.d/50unattended-upgrades<br /><br />**Posted: 2016-03-10 21:20:48**<br /><br />**Updated: 2019-05-05 11:58:47**<br /><br />";"2016.03.10-automating-ubuntu-14.04-automatic-updates.md"
"# Linux: rm Argument list too long<br /><br />**Engineer Level: Amateur (Beginner)**<br /><br />A problem that occasionally occurs is that when attempting to remove files in Unix or Linux system is that when you attempt to remove files from a directory, you are not able to do so.  This only happens when you have too many files in a particular directory.  <br /><br />What happens when you run ```rm *```<br />is that the OS gets the names of all the files in the directory that match that condition (which would be everything in this case) and changes the command to ```rm file1.txt file2.txt file3.txt file4.txt ...```<br />You get the idea.  The problem is sometimes the argument list is too long and the command is not able to process all of the files that are in the directory.  As a result, you'll get a ""Argument list too long"" error message and none of the files being deleted. <br /><br />How do you get around this problem? Here's the solution: <br /><br />```<br />for x in $(ls -1)<br />do<br />echo $x<br />rm $x<br />done<br />```<br /><br /><br />What does this do?  Lets explain: <br /><br />* ```for x in $(ls -1)```<br />gets all of the files that are in the directory.<br />* ```do```<br />denotes the beginning of the for loop<br />* ```echo $x```<br />will print out the name of the file that is being removed so that you can monitor the progress.<br />* ```rm $x```<br />removes the file.  The name of the file that is being removed was printed out by the previous line<br />* ```done```<br />denotes the end of the for loop<br /><br /><br /><br />If you have to clean up directories that often contain a lot of files, then placing this command in a script would be recommended than running it from the command line each time you need it.<br /><br />Other examples for using this command are as follows: <br />```<br />for x in $(ls -1 | grep 2016 | awk '{print $9}')<br />do<br />echo $x<br />rm $x<br />done<br />```<br /><br />This will remove all the files that have ""2016"" in the file name, year, or file size. <br /><br />```<br />for x in $(ls -1 *hello* | awk '{print $9}')<br />do<br />echo $x<br />rm $x<br />done<br />```<br /><br />This will remove all the files that have ""hello"" in the file name.<br /><br />**Posted: 2017-04-03 01:06:37**<br /><br />**Updated: 2019-05-12 21:03:06**<br /><br />";"2017.04.03-linux-rm-argument-list-too-long.md"
"# Liftmaster 8500 Review, 1 Year Later<br /><br />**Engineer Level: Amateur (Beginner)**<br /><br />1 year ago, I installed the Liftmaster 8500 on my garage door.  I cover the pros and cons that I have experienced during that time.  How is the Liftmaster 8500 performing a year it has been installed?  I will show you.  One year ago, I installed this Liftmaster 8500 garage door opener.  I bought it online and it came with everything I needed including the MyQ internet gateway.  <br /><br /><br />The first pro about this garage door open is that it is very quiet.  If I open the garage door while I'm on the other side of the house, I barely hear it  open.  The deadbolt that comes with the door actually is lower than the motor itself when it is  running.  <br /><br />The second pro with this is that the garage door opener is very easy to install.  If you're like me and you already have a garage door in place but just didn't have the opener,  this kit can be done very easily and quickly as a DIY task on a Saturday.  I had all of the necessary tools required to install it including the drill, some pliers,  may need a hammer or two as well.  I did have to mount some 2 by 4s to attach the opener as well as some of the sensors  to.  But outside of that, everything that was needed came with the kit.  <br /><br />The third pro for this garage door opener is that it came with the MyQ internet gateway.  The MyQ app allows you to open the garage door remotely so that you don't have to be  in the physical presence of the door.  This is great when you have to allow somebody in whether they are dropping off packages  or need to be let in the house like kids after school and you don't want to give them a key.  This particular garage door opener model support battery backup.  So if the power were to ever go out or you live in an area where the power frequently  goes out, you're always able to get inside of your garage if you have the battery backup.  Now I did not purchase the battery backup as my power is pretty consistent in staying  on majority of the time.  <br /><br />The fourth pro is that you're able to install this on the side of the garage door opener  instead of overhead.  The thing about being able to install it on the side of the garage door is that it leaves  more ceiling space for you to be able to do other things including installing overhead  lights or installing a ceiling fan.  In my case, I do have a ceiling fan in my garage.  I do live in the south, so in the summer time the garage gets pretty hot and the fan becomes  very essential in those time especially when you're working on a car or working on something  else in the garage.  Now to talk about the cons of this particular garage door model.  <br /><br /><br />The first con is that the garage door light does not always turn on when you go to open  the door.  At many of the times, I'll press the door open and I dont' know if it is due to network  interference or radio interference, but the light does not always turn on.  However once the door reach the top of the travel path, the light turns on. Now as I mentioned, this particular model comes with a remote light.  Meaning the light itself is not wired directly into the garage door system.  So just like the remote that you have in your car to open the garage door, the garage door  remotely controls the light using radio frequency.  Now it is possible that there is some sort of interference that sometimes occurs during  that time of day when I open to leave to go out to go to work.  However this is not always observed.  <br /><br />The second con that I have with this garage door opener is that the MyQ app will not tell  you when the door is partially open.  I've tried this on many scenarios and basically with the app and when you open the door and  it stops midway, or you intentionally stop it midway, or it stops midway on it's own,  the app wiil show in the history log that the door is registered into an unknown state.  The only problem with this is that the app cannot notify you of an unknown state.  It can only notify you of an open or closed state.  I've searched the MyQ forums as well as the Liftmaster forums, as well as the Chamberlain  forums, and none of them indicate a recommendation on how to address this issue.  The only response that I consistently saw was that they are working on a fix to include  this type of functionality.  However that was a year, maybe a year and a half ago and I haven't seen any improvement  in this request since then.  <br /><br />The third con that I have with this garage door opener is that it doesn't always immediately  close when using the MyQ app.  Often times I don't use the garage door opener that's available.  The clicker button if you will.  Instead I'll use to for the app functionality.  When I do press the button immediately after it opens to close the door right back, then  door often doesn't get the response.  However, the MyQ app shows on the screen that the door is actually going down while it is  not.  So this is a con that seems to consistently come up.  What I've found that I've had to do is to wait maybe twenty to thirty seconds after  the door fully opens and the MyQ app registers that the door is fully open.  Then close the door at that time.  <br /><br /><br />Overall, this garage door opener is a great purchase.  However the MyQ app does leave more to be desired in terms of functionality especially  in security area of notifying you when the door is partially open.  If this video has been helpful to you, please like and subscribe to our YouTube channel.  Also follow us on Facebook, Instagram, and Twitter at almostengr.<br /><br />**Posted: 2018-02-03 10:00:01**<br /><br />**Updated: 2019-06-13 21:14:45**<br /><br />";"2018.02.03-liftmaster-8500-review,-1-year-later.md"
"# Redirect to Home Assistant using Apache<br /><br />**Engineer Level: Amateur (Beginner)**<br /><br />This video tutorial provides steps on how to set up your Home Assistant server to redirect to the appropriate port number so that you don't have to manually enter it when connecting to the server.<br /><br /><iframe width=""560"" height=""315"" src=""https://www.youtube.com/embed/Zn9-tm5bHDY"" frameborder=""0"" allow=""autoplay; encrypted-media"" allowfullscreen=""""></iframe><br /><br /><br />**Posted: 2018-05-08 15:30:00**<br /><br />**Updated: 2019-05-05 11:58:28**<br /><br />";"2018.05.08-redirect-to-home-assistant-using-apache.md"
"# Install Drush on Ubuntu 16.04<br /><br />**Engineer Level: Amateur (Beginner)**<br /><br />This tutorial shows how to install Drush on your Ubuntu server. Drush allows for you to make changes to variables, perform actions, create and edit nodes, and more from the command line. <iframe width=""560"" height=""315"" src=""https://www.youtube.com/embed/U7oBoHA27Cg"" frameborder=""0"" allow=""autoplay; encrypted-media"" allowfullscreen></iframe> The commands that are entered in this video are as follows:<br />sudo apt-get update<br />sudo apt-get install drush<br /># Then change to a directory that contains a Drupal site<br />drush status drush cron<br /><br /><br />**Posted: 2018-05-22 13:00:01**<br /><br />**Updated: 2019-05-05 11:54:04**<br /><br />";"2018.05.22-install-drush-on-ubuntu-16.04.md"
"# Belkin Wemo Switch Unboxing<br /><br />**Engineer Level: Amateur (Beginner)**<br /><br /><iframe width=""560"" height=""315"" src=""https://www.youtube.com/embed/arxhIQYqwqk"" frameborder=""0"" allow=""autoplay; encrypted-media"" allowfullscreen></iframe><br /><br />This video is the unboxing of the Belkin Wemo Switch. This unboxing is of the full size Belkin Wemo. It shows the size of the Belkin wemo relative to the size of the wall outlet as well as the contents of the box.<br /><br />If you have comments or questions about the video, please leave them on the video's YouTube page.<br /><br />**Posted: 2018-05-29 15:00:00**<br /><br />**Updated: 2019-05-05 12:23:07**<br /><br />";"2018.05.29-belkin-wemo-switch-unboxing.md"
"# Setup MyQ with Home Assistant<br /><br />**Engineer Level: Amateur (Beginner)**<br /><br />This tutorial shows you how to set up MyQ to work with Home Assistant. The opener that is connected to in this tutorial is of the Liftmaster brand.<br /><br />​​​​​​​<iframe width=""560"" height=""315"" src=""https://www.youtube.com/embed/XIsLOTE8amU"" frameborder=""0"" allow=""autoplay; encrypted-media"" allowfullscreen=""""></iframe><br /><br /><br />**Posted: 2018-06-12 14:15:01**<br /><br />**Updated: 2019-05-05 12:32:09**<br /><br />";"2018.06.12-setup-myq-with-home-assistant.md"
"# Configure HDHomeRun Connect with Kodi on Ubuntu<br /><br />**Engineer Level: Amateur (Beginner)**<br /><br />This tutorial shows how configure the HDHomeRun Connect to work with Kodi on Ubuntu.<br /><br />For more information about the HDHomeRun Tuners, visit the product's website by visiting https://www.silicondust.com.<br /><br /><iframe width=""560"" height=""315"" src=""https://www.youtube.com/embed/kKdLCw4fREA"" frameborder=""0"" allow=""autoplay; encrypted-media"" allowfullscreen=""""></iframe><br /><br /><br />**Posted: 2018-06-26 18:00:03**<br /><br />**Updated: 2019-05-05 12:33:52**<br /><br />";"2018.06.26-configure-hdhomerun-connect-with-kodi-on-ubuntu.md"
"# Install HDHRViewer Plug-in for Live TV on Plex Media Server<br /><br />**Engineer Level: Amateur (Beginner)**<br /><br /><iframe width=""560"" height=""315"" src=""https://www.youtube.com/embed/xcp33HqGifE"" frameborder=""0"" allow=""autoplay; encrypted-media"" allowfullscreen></iframe><br /> <br />In this tutorial, you'll see how to install the HDHR Viewer plugin in Plex Media Server. This plugin allows you to watch content cable or OTA (over the air) television through your Plex Media Server setup.<br /> <br />This particular set up is useful for those that do not have a Plex Pass, but want to watch television provided by their HDHomeRun device.<br /> <br />Link to HDHRView Repository: https://github.com/zynine-/HDHRViewerV2.bundle<br /> <br /><br /><br />**Posted: 2018-08-14 12:30:00**<br /><br />**Updated: 2019-05-05 12:20:46**<br /><br />";"2018.08.14-install-hdhrviewer-plug-in-for-live-tv-on-plex-media-server.md"
"# Upgrade Ubuntu 16.04 LTS to 18.04 LTS Upgrade (No Commentary)<br /><br />**Engineer Level: Amateur (Beginner)**<br /><br /><iframe width=""560"" height=""315"" src=""https://www.youtube.com/embed/juY3pZPVSNw"" frameborder=""0"" allow=""autoplay; encrypted-media"" allowfullscreen></iframe><br /><br />This video shows how to upgrade Ubuntu 16.04 LTS Server Edition to Ubuntu 18.04 LTS Server Edition.  <br /><br />This video does not have any verbal commentary as the purpose of this video is to show you the screen output that is generated when the upgrade is performed. Therefore if you run into any issues when performing your upgrade, you can use this video to see how far along your upgrade made it through the process. <br /><br />This video is the full length upgrade from Ubuntu 16.04 LTS to Ubuntu 18.04 LTS. Pauses from prompts have bee nremoved so that you can see the amount of time required to complete the upgrade and what to expect when performing the upgrade on your server or desktop. <br /><br />The scenes have not been shortened and were recorded in real time. <br /><br />A separate video tutorial with commentary is available in a separate video. <br /><br />If you have comments or questions about the video, please leave them on the video's YouTube page.<br /><br />**Posted: 2018-09-22 09:30:03**<br /><br />**Updated: 2019-05-05 12:28:50**<br /><br />";"2018.09.22-upgrade-ubuntu-16.04-lts-to-18.04-lts-upgrade-(no-commentary).md"
