"# Bird is the Word<br /><br />**Engineer Level: Amateur (Beginner)**<br /><br />Since I've been gardening, I've noticed that a particular bird has been present pretty regularly when I go outside.<br /><br /><br /><br /><br />**Posted: 2019-04-16 19:45:43**<br /><br />**Updated: 2019-04-16 19:45:43**<br /><br />";"2019.04.16-bird-is-the-word.md"
"# Read An Audio Book<br /><br />**Engineer Level: Amateur (Beginner)**<br /><br />some text<br /><br /><br />**Posted: 2019-04-30 22:20:30**<br /><br />**Updated: 2019-04-30 22:20:30**<br /><br />";"2019.04.30-read-an-audio-book.md"
"# 7 Steps for More Steps<br /><br />!(images/20190509_075032.jpg)<br /><br />**Engineer Level: Amateur (Beginner)**<br /><br />As research has frequently mentioned, one of the many keys to remaining healthy is to have an active lifestyle. One of the recommendations to achieve this is to walk at least 10,000 steps per day, which equates to about 5 miles. Make note that with this recommendation, that you do not have to get all 5 miles done in a single setting or activity.<br><br>The problem that I noticed was that I work a 9-5 desk job, and there’s really no walking involved for that line of work. After researching and hearing about the consequences of sitting or lack of walking, I decided to make some adjustments to my habits to get more steps in per day.<br><br>I have a phone and activity tracker that track the number of daily steps. On a typical day where I went from home to work to home without stopping anywhere else, I would log about 2,500 to 3,500 steps per day. That is way below the recommended 10,000 steps per day. So here’s how I chose to try to gain more steps per day without hitting the treadmill or park.<br><br><br>**HACK 1) PARK IN THE FIRST EMPTY SPOT**<br><br>If you really want some steps, park in the space that is closest to the road and not the store or restaurant that you are going into. Now personally I do not try to park at the door or ride around for finding the closest spot and I also do not park at the very end of the parking lot. Usually, I'll park in between the road and the store. The rule that I do follow is that I do not drive down more than two (2) aisles when looking for a parking space. Not only does riding around looking for the closest parking space waste gas, it also and reduce the number of steps that you get. This adds about 100-200 steps per occurrence.<br><br><br>**HACK 2) NO DRIVE-THRUS**<br><br>If I go out to eat and the restaurant has a drive through, I skip it and go inside to the counter. Through trail and error from doing this, I have found that by going inside instead of going into the drive-thru, I’m actually able to get in and out faster than those in the drive through. If you believe my experience is flawed, there is a survey that was done by QSR Magazine that stated that the drive-thru line wait time increased from 2013 to 2014 by 40 seconds. In addition, sitting in the drive through wastes gas unless you are driving an electric, hybrid, or auto-stop vehicle. Next time that you go to a fast-food restaurant, as you walk into the restaurant and take note of the last car that is in the drive through line and see if you walk out of the restaurant before the car gets out of the drive thru. This adds about 100-150 steps per occurrence.<br><br><br>**HACK 3) TAKE THE STAIRS**<br><br>If you have the option to take the stairs or the elevator, the default I recommend is to take the stairs. However, if there are no stairs then take the escalator and walk down it. Now if you work or live in a tall building and cannot take all the stairs to your floor, then go as many flights of steps that you can tolerate and take the elevator the rest of the way. This adds about 10-30 steps per floor.<br><br><br>**HACK 4) WHEN YOU GOTTA GO, GO FURTHER**<br><br>At my job, the restroom is about 20 steps from my desk. The next closest restroom in the office building is about 75 steps, including a flight of stairs (see Hack 3). Just by going to another floor, that’s almost 3 times the number of steps. Round trip, that is about 150 steps and traversing two flights of stairs. If your home has multiple stories with a bathroom on each, then when you have to use the bathroom, go to the bathroom on a floor that you are not on. If your home is single story, then go to the bathroom that is furthest from you or make multiple trips to and from where you are before you go. This adds about 110 steps at work and 40 at home each time that I go.<br /><br>**HACK 5) DRINK MORE WATER**<br><br>I know what you are thinking… water has nothing to do with steps. Actually it does though. By drinking more water, you will go to the bathroom more often. When you go to the bathroom more often, then you can apply Hack 4 to get more steps. Before using this hack, I would probably go to the restroom once, sometimes twice, while at work. Now that I drink more water, I go at least two or more times per day. Each time I go, I apply Hack 3 and 4.<br><br><br>**HACK 6) SET REMINDERS, PEDOMETER ALERTS**<br><br>I have a pedometer that I wear on my wrist. If it does not detect that I have taken any steps within the last hour, it will buzz and remind me to get some steps in. When it does go off and I am at work, I will get up to use the restroom (Hack 4), get some water (Hack 5), or talk to a coworker in person. If I am on a conference call when it goes off, I will stand up, stretch, and take some steps in my cubicle. The amount of steps this hack will add will vary.<br><br><br>**HACK 7) WALK AROUND YOUR CAR OR HOUSE BEFORE YOU GO IN**<br><br>One day, I was waiting at a red light located near a fire station. I noticed some of the firefighters went around to the back of the fire house on the right side. After about 15 seconds, some firefighters came from the back of the firehouse on the left side. However, it was not the group that had gone around on the right. About another 10 more seconds, the group I saw that went around on the right side was coming around on the left side and it occurred to me that they were doing laps. Firefighters cannot leave the firehouse while on shift, because they have to respond when a call comes in, they ran laps around the firehouse as their physical activity. Applying this same strategy, I will sometimes walk around by car before getting in it or walk around my house before going inside. During the walk around the car, I pay attention to the tires and look for any scratch marks or dings that may have appears. When walking around the house, I look at the roof and exterior to see if anything significant has changed. This adds about 25 steps when walking around the car and about 150 steps when walking around the house per occurrence. The amount of steps this hack will add will vary.<br><br>By doing a combination of these hacks, I've been able to increase my minimal step range from 2500-3500 range to the 4000-5000 range. I know you think that is not a lot, but keep in mind that every step counts. Hopefully, this has inspired you to take small steps in adding steps to your day. If you have additional steps (no pun intended) that you use to get more steps per day, add them in the comments below.<br /><br /><br />**Posted: 2019-05-09 06:00:00**<br /><br />**Updated: 2019-05-12 13:22:27**<br /><br />";"2019.05.09-7-steps-for-more-steps.md"
"# Drupal 8 Tutorial Series<br /><br />!(images/drupal 8 logo isolated CMYK 72.png)<br /><br />**Engineer Level: Amateur (Beginner)**<br /><br />Over the next several weeks, I will be releasing a series of videos about how to install and set up a Drupal 8 website.<br /><br />Drupal is one of the most known Content Management Systems (CMS) that exists today. Many government website use it for their content including the White House (whitehouse.gov).<br /><br />All of the videos in this series will be available on my YouTube Channel in a playlist for your convience. The playlist can be watched by visiting<a href=""https://www.youtube.com/playlist?list=PLaAJ0fv0d9WM8E2K_Ke5As-fw626yQ3tu"">https://www.youtube.com/playlist?list=PLaAJ0fv0d9WM8E2K_Ke5As-fw626yQ3tu</a><br /><br /><br />**Posted: 2019-06-11 21:57:19**<br /><br />**Updated: 2019-06-13 13:49:46**<br /><br />";"2019.06.11-drupal-8-tutorial-series.md"
"# 3 Benefits of Doing Something Different When Stuck<br /><br />!(images/blur-button-car-1827232.jpg)<br /><br />**Engineer Level: Amateur (Beginner)**<br /><br />As some of you may know, I build automations as part of my day job. Sometimes, I do find myself getting stuck on building an automation. When it comes to programming, you can do an online search and find an example or the exact code for the thing that you are trying to program but cannot figure out how. However, there are times where the answer cannot be found on Stack Overflow. I know every programmer that is reading this probably had a facial reaction or yelled an expletive to the previous sentence, but it is true. I will admit, Stack Overflow does have a lot of the answers to the most common routine programming and computer questions, but there are still unknown unknowns that it does not have the answers to. <br /><br />In my younger programming days (you better not be laughing), I would keep trying different ways of accomplishing the programming task.<span style=""mso-spacerun:yes""> </span>This, continue working on it until you get it right approach, would work some of the time because I would become so focused on the program until I got it right.<span style=""mso-spacerun:yes""> </span>Things have changed since then. New technologies have taken over (Python gasp). New programmers are not following the common standards or the specific language, like starting Java functions with an upper case letter, or just coming up with their own standards and wonder why other programmers do not want to touch what they have created. <br /><br />**ONE: YOU GET MORE WORK DONE **<br />With the automation team that I work with, we use JIRA for our task tracking.<span style=""mso-spacerun:yes""> </span>I put those JIRA tasks and the amount of time I spend on each task on my Outlook calendar, so that I can get a visual of how much time that I have spent on a given task in comparison to my week. By combining the visual from Outlook calendar and the Scrum Board from JIRA, I realized that I was completing fewer tasks in less time when I got stuck with a programming issue.<span style=""mso-spacerun:yes""> </span>Those of you familiar with Burn Down Rates and how it can impact a project will probably understand this the best.<br />Staring at the round peg to see how you can get it in the square hole will not make the solution come by easier. If you know that you have other square pegs to place into square holes, then you can work on those and come back to the round peg and sqaure hole. <span style=""mso-spacerun:yes""></span>I have even completed lower priority tasks before higher priority tasks because I knew that I had or could reach the solution to that lower priority task faster than the higher priority task.<span style=""mso-spacerun:yes""> </span>Some project managers may balk at this approach. If they do, my recommendation would be to reference your Burn Down Rate so that they see that you are completing more tasks, although it may not be the high priority ones. <span style=""mso-spacerun:yes""></span><br /><br />**TWO: THE NUMBERS FAVOR YOU**<br />The more that you are able to complete in given amount of time, the more valuable and productive that you appear.<span style=""mso-spacerun:yes""> </span>If your manager is only concerned with the numbers and not the science or reasoning behind the numbers, then this tip is great for you. Managers that only look at the numbers and not the data that supports the numbers think that things are going great because more tasks are getting completed.<span style=""mso-spacerun:yes""> </span>However, if you have 10 tasks that are to be completed within a sprint, and 5 of those are defects from crappy done work in a previous sprint, then you are really only completing 5 new items instead of 10, thus 50% new feature rate.<span style=""mso-spacerun:yes""> </span>Solely looking at the numbers may not convey this point depending on how it is presented.<span style=""mso-spacerun:yes""> </span>If your manager actually wants to know the science or reasoning behind the numbers, this will probably get you on the Naughty List. When I work on an automation, I design it in a way so that unless something major changes (e.g. API changes, new elements on a page, conversion to new technology), that automation will work correctly and has the intelligence to handle minor issues that may occur. That way I’m truly completing the tasks assigned and not repeatedly patching defects or making small adjustments, thus reducing the number of new automations that I can complete. <br /><br />**THREE: LESS MENTAL FATIGUE AND STRAIN**<br />Since I was not so dedicated with completing one single task before moving on to the next, I realized that I was able to complete the work without being as mentally drained at the end of the day. Programming does not require much physical effort as most programmers either stand or sit in one spot while they do their work.<span style=""mso-spacerun:yes""> </span>However the ability to be able to assemble things in a logical fashion takes a lot of mental effort.<span style=""mso-spacerun:yes""> </span>Combine that with not being able to complete a given task, in other words doing the same thing over and getting the same results, and you will have a high level of frustration and a low sense of accomplishment. <br /><br /><br />This article was written with programming and technology examples included. However do note that the main points can be applied to anything that you encounter.  For instance:<br />Cannot figure out why the tv will not turn on? Go listen to the radio. Later, check the power cord, surge protector if it is plugged into one, and replace the remote batteries.<br>Cannot figure out why the ice maker is not making ice? Go buy some ice. Later, check to see if the water line is connected and that it has power. Worse case by another fridge.<br>Cannot figure out why that person cut you off in traffic and did not use his or her turn signal? Let them go on down the road. Then pray for that driver’s bad habit be removed from them and continue on to your destination. <br /><br /><br /><br />**Posted: 2019-06-13 12:58:19**<br /><br />**Updated: 2019-06-14 12:42:47**<br /><br />";"2019.06.13-3-benefits-of-doing-something-different-when-stuck.md"
"# 7 Reasons I Can Do That Without The App<br /><br />!(images/Screenshot_2019-06-25-22-01-37.png)<br /><br />**Engineer Level: Amateur (Beginner)**<br /><br />These days, everybody wants you to download their app. However, before installing an app, I ask myself whether I really do need the app. Every company's answer to this is ""Yes with sprinkles on the side"". Sometimes having an app does help you out to be more productive.<span style=""mso-spacerun:yes""> </span>Other times, it is a waste of space and a way for the company to spy on you and your activities so that they can target you with ads.<span style=""mso-spacerun:yes""> </span>That being said, here are seven reasons why I am hesitant to install new apps. <span style=""mso-spacerun:yes""></span><br /><br />**REASON ONE: MOBILE FRIENDLY WEBSITE**<br />It is no secret that majority of the online traffic today comes from some sort of mobile device. As part of setting up AdSense on The Almost Engineer website, I had the liberty of reading through and researching some of the requirements in order to get ranked on Google. Websitesidentified by the Google Search Crawleras being mobile-friendly, are given higher ranking than those that do not. This change was made by Google in 2018 and some high ranking websites saw their website impressions drop as a result. With this change, that means the features that are available on the website from my computer should also be available and work on my mobile device. I have not had the Facebook app installed on my phone for over 3 years. Those of you that use Facebook are probably wondering how that is possible. It is possible because the features that I most commonly use on Facebook, like uploading photos, posting status updates, checking the news feed, and sending messages, I am all able to do from the mobile website. The only down side to this, if you consider it to be one, is that you do not get real time notifications for comments, likes, or event reminders. Which brings me to my next reason...<br /><br />**REASON TWO: LESS NOTIFICATIONS**<br />Today's society is constantly connected. Research has been done in recent years that has proven that we are more connected to each other through our phones and less in person. To add to the frenzy, notifications that you receive often distract you from what you are currently doing or disconnect you from the people that are around you. An example of this would be the couple out to dinner and both of them are on their phones looking at whatever instead of looking at each other having a conversation or paying attention to the restaurant that they are in. Most mobile websites do not have the capabilities to make the browser throw device notifications. Thus you are able to better focus on what you are doing, like paying attention to that driver that is about to cut you off, that your date got a new dress and new heels, or completing that 5 minute task that your boss emailed you about that is taking you 20 minutes to complete. I believe that multi-tasking is a myth. When I really need to get stuff done, I put my phone on vibrate and put it out of sight (e.g. in pocket, another room). Often I'm surprised that I'm able to get so much done in a short amount of time. Then I realize that I was able to focus on one task at a time and work diligently until I was able to complete it. I have a couple of apps that would throw notifications at or around the same time every day wanting me to buy something (Groupon) or to look at an offer (Ibotta) even if I had not opened the app. After a while, this became annoying and I blocked the app from displaying any notifications at the operating system level.<br /><br />**REASON THREE: PHONE SPACE**<br />Apps take up space. Some take up more than others. At last check, the Facebook app is over 150MB. Compare that to other apps, and that is a large application. To add to that, apps store data on your phone. For instance, Facebook, Instagram, and Twitter will cache some of the data on your phone that they have downloaded in the background. Over time, this cached data, if not removed, will slow down your phone and reduce your battery life. Meanwhile, I could be using that phone space to store videos, photos, music, audio books... you get the idea.<br /><br />**REASON FOUR: IT MAY BE OLD, BUT IT STILL WORKS**<br />When you do not rely on the app to be able to interact with a website or service, you can use an older phone. Periodically, Android raises the minimum version that apps have to comply with.<span style=""mso-spacerun:yes""> </span>Some app developers, mandate that you have an operating system that is no more than 3 versions behind the latest stable version available. About a year ago, I encountered this with the Southwest app. I have Android Lollipop on my phone. In an update, Southwest made the minimum version to Android Marshmallow, thus not allowing me to have the app on my phone. Southwest mobile website does everything that the app does, including displaying my boarding pass, so I started using that and uninstalled the app. Yes… I know that I could have went and got a new phone so that I could have continued to use the app.<span style=""mso-spacerun:yes""> </span>No… I could not justify the cost of getting a new phone for convenience of being able to check-in on a flight about 2 to 3 times per year. Besides if I had issues with the mobile website, Southwest lets you print boarding passes for free. <br /><br />**REASON FIVE: IOS VERSUS ANDROID APPEARANCE AND FEATURES**<br />If you are an Android person asking an iPhone user how to do something in an app, there is a 50/50 chance that the directions given will not work. Same goes for the other way around. Why is that? Well iPhone apps have to follow Apple standards in order to be listed in the App Store.Android apps do not have similar standards. In addition, some apps are built upon the features that are native to that operating system. Therefore, if one system interprets ""and"" as ""&amp;"" and the other interprets it as ""+"", then you will get two different outcomes for the same thing. This problem is not as big now as it was in the past thanks to programming languages such as Xamarin, which allow for code to be written once and be compatible for iOS and Android platforms.<br /><br />**REASON SIX: INFORMATION APPS ARE A WASTE**<br />In the past, I've done consultations for small businesses and startups and they claim that one of main things that they want to do as part of getting their business off the ground is to create an app. Some do have their preferences about getting aniOS app built before the Android app and vice versa, but that is not the point of this reason. When people say that they want an app built, the next part of the conversation usually goes like this:<br />KENNY: In the initial version of the app, what would the app do?<br />CLIENT: Provide information about myself (usually the owner or founder), what we do, and some pictures of our work/services.<br />KENNY: Anything else beyond that?<br />CLIENT: No. Oh... wait... and be able to contact us from the app.<br />KENNY: The going rate to have an iPhone app createdis x-thousands of dollars and the cost for an Android app is x-hundreds of dollars.<br />CLIENT: It costs that much? Let me shop around to see who else I can find.<br />Long story short... they never end up getting the mobile app. Most people will not download anappbecause they want information about your business. That is what your website is for. People download apps because they want additional features that are not available via your website or to enhance the functionality of their phone. For instance, some people, myself included, have multiple email accounts. I would not download an email app that only supported one email account. While it is true that I could have all of my email forwarded to a single account, I have multiple accounts because each account has a designated purpose. I do not want my ""daily coupon and specials"" emails be merged in with my ""new billing statement available"" emails.<br /><br />**REASON SEVEN: THE APP IS A FANCY WEB BROWSER**<br />Try this... go to your app and take a note of its appearance. Then go to the website (or mobile website) that is associated with that app. If the app and the mobile website look the same, there is a 99.999999994% (yes that last 4 is significant) chance that the app that you have is just a web browser that only allows you to access that company's website. That's right... there are companies that are building mobile friendly websites and then building apps that only navigate to that mobile friendly website. I am not going to mention their names, but some financial institutions that I have done business with have done this in the past. In addition, I did some contract work for a service provider. That service provider wascharging about $1,000 for the mobile app. All they were doing were changing the default URL in the app,installing a WordPress plugin so that the page would render as being mobile friendly, and publishing it to the App or Play Store. All of thattook about a 1 hour to complete. <br /><br />While these strategies may not work for you, I find my phone to be less of a maintenance annoyance and pain point for keeping updated since I am using fewer apps. It is true that ""There's an app for that"". With that in mind, I challenge you to think of whether you really need that app before installing it. <br /><br /><br />**Posted: 2019-06-16 22:54:13**<br /><br />**Updated: 2019-06-26 20:31:39**<br /><br />";"2019.06.16-7-reasons-i-can-do-that-without-the-app.md"
