"# NSBE MP Scholarship Module<br /><br />In an effort to keep up with modern times, NSBE MP chose to add a new way to allow students to apply for its yearly scholarship. In addition, most students would submit hand-written applications. This made reviewing the applications by the scholarship committee lengthy as some applicants handwriting was difficult to understand.  <br /><br />Additional functionality was needed for the NSBE MP website to allow high school and collegiate students to apply for the NSBE MP scholarship online.  <br /><br /><br /><br />**Posted: 2015-10-06 22:22:53**<br /><br />**Updated: 2018-02-03 22:47:29**<br /><br />";"2015.10.06-nsbe-mp-scholarship-module.md"
"# Green Screen with Flash videos in Windows 10<br /><br />Great!!! You've upgrade to Windows 10.  No issues thus far.  Then you go to one of your favorite websites to watch some videos.  Once the video starts playing, instead of seeing cats all over the place you just see green.    Well apparently all with Windows 10 isn't good.  To fix this infinite green screen, do the following: <br /><br />1) Begin playing a flash video.  NOTE: Youtube utilizes HTML5 to play videos, so you may not see a green screen there. <br />2) Right-click on the player window. <br />3) Uncheck the ""Enable hardware acceleration"" box. <br />4) Refresh the page <br /><br />When you retry to play the video after refreshing the page, you should be able to see the cats all over the place instead of green like a golf course. <br /><br /><br />**Posted: 2015-10-07 23:27:57**<br /><br />**Updated: 2019-03-08 23:33:47**<br /><br />";"2015.10.07-green-screen-with-flash-videos-in-windows-10.md"
"# How to disable foreign key constraints in MySQL<br /><br />Why would you want to disable a foreign key constraint?  Well there are some scenarios... such as when you are refreshing your testing or development environment with production data or when you are restoring your production environment from a backup after an unfortunate mishap.  <br /><br />So how do you disable your constraints: <br /><br />```<br />set foreign_key_checks=0;<br />```<br /><br /><br />Once you have done the necessary options, then you can re-enable them by running<br /><br />```<br />set foreign_key_checks=1;<br />```<br /><br /><br />That's it.<br /><br />**Posted: 2015-10-21 21:26:43**<br /><br />**Updated: 2019-03-08 23:33:47**<br /><br />";"2015.10.21-how-to-disable-foreign-key-constraints-in-mysql.md"
"# Java Swap Values<br /><br />This program swaps the values of two inputs and then prints them back out to the console.<br /><br />```<br />package com.bitsecondtech.swapvalues;<br />import java.util.Scanner;<br />public class Swapper {<br /><br />private static int x; <br />private static int y;<br />/**<br />* @param args<br />*/<br />public static void main(String[] args) {<br /> <br /> System.out.println(""Enter two integer values: "");<br /> Scanner sc = new Scanner(System.in);<br /> x = sc.nextInt();<br /> y = sc.nextInt();<br /> <br /> swapValues(x, y);<br /><br /> systemPause();<br />}<br /><br />public static void systemPause(){<br /> System.out.println(""Press any key to continue..."");<br /> new Scanner(System.in).nextLine();<br />}<br /><br />private static void swapValues(int x, int y){<br /> int temp;<br /> <br /> System.out.println(""Original values: "" + x + "" "" + y);<br /> temp = x;<br /> x = y; <br /> y = temp; <br /> System.out.println(""Values swapped: "" + x + "" "" + y);<br />}<br />}<br />```<br /><br /><br />**Posted: 2015-10-30 20:26:25**<br /><br />**Updated: 2019-03-08 20:10:05**<br /><br />";"2015.10.30-java-swap-values.md"
"# How to keep a form from losing focus - VB.Net<br /><br />If you want to keep a form from losing focus (i.e. options/preferences form) in your VB.Net program you can use the code below. This code was originally posted <a href=""http://www.codeproject.com/Tips/80263/How-to-prevent-Form-from-loosing-focus-in-the-appl.aspx"" target=""_blank"">here</a><br /><br /><br /><br /><br /><br />```<br />Protected Overrides Sub OnLostFocus(ByVal e As System.EventArgs)<br /><br />MyBase.OnLostFocus(e)<br /><br />Me.Focus()<br /><br />End Sub<br /><br />Protected Overrides Sub OnDeactivate(ByVal e As System.EventArgs)<br /><br />MyBase.OnDeactivate(e)<br /><br />Me.Focus()<br /><br />End Sub<br />```<br /><br /><br />**Posted: 2015-10-30 20:28:01**<br /><br />**Updated: 2019-03-08 20:10:05**<br /><br />";"2015.10.30-how-to-keep-a-form-from-losing-focus-vb.net.md"
"# ASP.Net Application Errors<br /><br />I've been working with an ASP.Net application.<br /><br />After publishing the application and moving it to the server, initially I would get an error message saying that the application was unable to run and to add some code to the web.config file.<br /><br />The code stated something about enabling CustomErrors.  More information about the CustomErrors tag can be found here http://msdn.microsoft.com/en-us/library/h0hfz6fc.aspx<br /><br />**Posted: 2015-10-30 20:29:58**<br /><br />**Updated: 2019-03-09 00:46:58**<br /><br />";"2015.10.30-asp.net-application-errors.md"
"# Rename a file - VB.Net<br /><br />' Change ""c:\test.txt"" to the path and filename for the file that<br />' you want to rename.<br />My.Computer.FileSystem.RenameFile(""C:\Test.txt"", ""SecondTest.txt"")<br /><br /><br /><br />Source: <a href=""http://msdn.microsoft.com/en-us/library/5w05844e%28v=vs.80%29.aspx"">MSDN</a><br /><br />**Posted: 2015-10-30 20:30:31**<br /><br />**Updated: 2019-03-08 20:10:05**<br /><br />";"2015.10.30-rename-a-file-vb.net.md"
"# Select List of US States<br /><br /><span style=""font-weight:bold;"">The list with Postal Codes </span><br /><br />&lt;select name=""State""&gt;<br />&lt;option value="""" selected=""selected""&gt;Select a State&lt;/option&gt;<br />&lt;option value=""AL""&gt;Alabama&lt;/option&gt;<br />&lt;option value=""AK""&gt;Alaska&lt;/option&gt;<br />&lt;option value=""AZ""&gt;Arizona&lt;/option&gt;<br />&lt;option value=""AR""&gt;Arkansas&lt;/option&gt;<br />&lt;option value=""CA""&gt;California&lt;/option&gt;<br />&lt;option value=""CO""&gt;Colorado&lt;/option&gt;<br />&lt;option value=""CT""&gt;Connecticut&lt;/option&gt;<br />&lt;option value=""DE""&gt;Delaware&lt;/option&gt;<br />&lt;option value=""DC""&gt;District Of Columbia&lt;/option&gt;<br />&lt;option value=""FL""&gt;Florida&lt;/option&gt;<br />&lt;option value=""GA""&gt;Georgia&lt;/option&gt;<br />&lt;option value=""HI""&gt;Hawaii&lt;/option&gt;<br />&lt;option value=""ID""&gt;Idaho&lt;/option&gt;<br />&lt;option value=""IL""&gt;Illinois&lt;/option&gt;<br />&lt;option value=""IN""&gt;Indiana&lt;/option&gt;<br />&lt;option value=""IA""&gt;Iowa&lt;/option&gt;<br />&lt;option value=""KS""&gt;Kansas&lt;/option&gt;<br />&lt;option value=""KY""&gt;Kentucky&lt;/option&gt;<br />&lt;option value=""LA""&gt;Louisiana&lt;/option&gt;<br />&lt;option value=""ME""&gt;Maine&lt;/option&gt;<br />&lt;option value=""MD""&gt;Maryland&lt;/option&gt;<br />&lt;option value=""MA""&gt;Massachusetts&lt;/option&gt;<br />&lt;option value=""MI""&gt;Michigan&lt;/option&gt;<br />&lt;option value=""MN""&gt;Minnesota&lt;/option&gt;<br />&lt;option value=""MS""&gt;Mississippi&lt;/option&gt;<br />&lt;option value=""MO""&gt;Missouri&lt;/option&gt;<br />&lt;option value=""MT""&gt;Montana&lt;/option&gt;<br />&lt;option value=""NE""&gt;Nebraska&lt;/option&gt;<br />&lt;option value=""NV""&gt;Nevada&lt;/option&gt;<br />&lt;option value=""NH""&gt;New Hampshire&lt;/option&gt;<br />&lt;option value=""NJ""&gt;New Jersey&lt;/option&gt;<br />&lt;option value=""NM""&gt;New Mexico&lt;/option&gt;<br />&lt;option value=""NY""&gt;New York&lt;/option&gt;<br />&lt;option value=""NC""&gt;North Carolina&lt;/option&gt;<br />&lt;option value=""ND""&gt;North Dakota&lt;/option&gt;<br />&lt;option value=""OH""&gt;Ohio&lt;/option&gt;<br />&lt;option value=""OK""&gt;Oklahoma&lt;/option&gt;<br />&lt;option value=""OR""&gt;Oregon&lt;/option&gt;<br />&lt;option value=""PA""&gt;Pennsylvania&lt;/option&gt;<br />&lt;option value=""RI""&gt;Rhode Island&lt;/option&gt;<br />&lt;option value=""SC""&gt;South Carolina&lt;/option&gt;<br />&lt;option value=""SD""&gt;South Dakota&lt;/option&gt;<br />&lt;option value=""TN""&gt;Tennessee&lt;/option&gt;<br />&lt;option value=""TX""&gt;Texas&lt;/option&gt;<br />&lt;option value=""UT""&gt;Utah&lt;/option&gt;<br />&lt;option value=""VT""&gt;Vermont&lt;/option&gt;<br />&lt;option value=""VA""&gt;Virginia&lt;/option&gt;<br />&lt;option value=""WA""&gt;Washington&lt;/option&gt;<br />&lt;option value=""WV""&gt;West Virginia&lt;/option&gt;<br />&lt;option value=""WI""&gt;Wisconsin&lt;/option&gt;<br />&lt;option value=""WY""&gt;Wyoming&lt;/option&gt;<br />&lt;/select&gt;<br /><br /><br /><span style=""font-weight:bold;"">The list without Postal Codes </span><br /><br />&lt;select name=""client_state""&gt;<br />&lt;option selected=""selected"" value=""""&gt; -Select- &lt;/option&gt;<br />&lt;option value=""Alabama""&gt;Alabama&lt;/option&gt;<br />&lt;option value=""Alaska""&gt;Alaska&lt;/option&gt;<br />&lt;option value=""Arizona""&gt;Arizona&lt;/option&gt;<br />&lt;option value=""Arkansas""&gt;Arkansas&lt;/option&gt;<br />&lt;option value=""California""&gt;California&lt;/option&gt;<br />&lt;option value=""Colorado""&gt;Colorado&lt;/option&gt;<br />&lt;option value=""Connecticut""&gt;Connecticut&lt;/option&gt;<br />&lt;option value=""Delaware""&gt;Delaware&lt;/option&gt;<br />&lt;option value=""District Of Columbia""&gt;District Of Columbia&lt;/option&gt;<br />&lt;option value=""Florida""&gt;Florida&lt;/option&gt;<br />&lt;option value=""Georgia""&gt;Georgia&lt;/option&gt;<br />&lt;option value=""Hawaii""&gt;Hawaii&lt;/option&gt;<br />&lt;option value=""Idaho""&gt;Idaho&lt;/option&gt;<br />&lt;option value=""Illinois""&gt;Illinois&lt;/option&gt;<br />&lt;option value=""Indiana""&gt;Indiana&lt;/option&gt;<br />&lt;option value=""Iowa""&gt;Iowa&lt;/option&gt;<br />&lt;option value=""Kansas""&gt;Kansas&lt;/option&gt;<br />&lt;option value=""Kentucky""&gt;Kentucky&lt;/option&gt;<br />&lt;option value=""Louisiana""&gt;Louisiana&lt;/option&gt;<br />&lt;option value=""Maine""&gt;Maine&lt;/option&gt;<br />&lt;option value=""Maryland""&gt;Maryland&lt;/option&gt;<br />&lt;option value=""Massachusetts""&gt;Massachusetts&lt;/option&gt;<br />&lt;option value=""Michigan""&gt;Michigan&lt;/option&gt;<br />&lt;option value=""Minnesota""&gt;Minnesota&lt;/option&gt;<br />&lt;option value=""Mississippi""&gt;Mississippi&lt;/option&gt;<br />&lt;option value=""Missouri""&gt;Missouri&lt;/option&gt;<br />&lt;option value=""Montana""&gt;Montana&lt;/option&gt;<br />&lt;option value=""Nebraska""&gt;Nebraska&lt;/option&gt;<br />&lt;option value=""Nevada""&gt;Nevada&lt;/option&gt;<br />&lt;option value=""New Hampshire""&gt;New Hampshire&lt;/option&gt;<br />&lt;option value=""New Jersey""&gt;New Jersey&lt;/option&gt;<br />&lt;option value=""New Mexico""&gt;New Mexico&lt;/option&gt;<br />&lt;option value=""New York""&gt;New York&lt;/option&gt;<br />&lt;option value=""North Carolina""&gt;North Carolina&lt;/option&gt;<br />&lt;option value=""North Dakota""&gt;North Dakota&lt;/option&gt;<br />&lt;option value=""Ohio""&gt;Ohio&lt;/option&gt;<br />&lt;option value=""Oklahoma""&gt;Oklahoma&lt;/option&gt;<br />&lt;option value=""Oregon""&gt;Oregon&lt;/option&gt;<br />&lt;option value=""Pennsylvania""&gt;Pennsylvania&lt;/option&gt;<br />&lt;option value=""Rhode Island""&gt;Rhode Island&lt;/option&gt;<br />&lt;option value=""South Carolina""&gt;South Carolina&lt;/option&gt;<br />&lt;option value=""South Dakota""&gt;South Dakota&lt;/option&gt;<br />&lt;option value=""Tennessee""&gt;Tennessee&lt;/option&gt;<br />&lt;option value=""Texas""&gt;Texas&lt;/option&gt;<br />&lt;option value=""Utah""&gt;Utah&lt;/option&gt;<br />&lt;option value=""Vermont""&gt;Vermont&lt;/option&gt;<br />&lt;option value=""Virginia""&gt;Virginia&lt;/option&gt;<br />&lt;option value=""Washington""&gt;Washington&lt;/option&gt;<br />&lt;option value=""West Virginia""&gt;West Virginia&lt;/option&gt;<br />&lt;option value=""Wisconsin""&gt;Wisconsin&lt;/option&gt;<br />&lt;option value=""Wyoming""&gt;Wyoming&lt;/option&gt;<br />&lt;/select&gt;<br /><br />**Posted: 2015-10-30 20:31:22**<br /><br />**Updated: 2019-03-08 23:34:29**<br /><br />";"2015.10.30-select-list-of-us-states.md"
"# Grails - Re-create Controller and Views for updated Domain class<br /><br />I did some work with Grails (version 1.3.7) and Groovy today. I use SpringSource ToolSuite as my IDE.<br /><br /><br /><br /><br /><br />If you change the variables in the domain class, then you will have to update the controller and views in order for the new fields to be shown/remove. To update the controller and views with new variables in the domain class, you must execute the ""generate-all"" command to re-create the controller and views with the added/removed variables. <br /><br /><br /><br />In the worse case, delete the controller and views and then re-add them by using the ""generate-all"" command if using the command prompt or by right clicking on the project > New > Generate Controllers and Views if using the SpringSource ToolSuite.<br /><br />**Posted: 2015-10-30 20:31:55**<br /><br />**Updated: 2019-03-08 20:10:05**<br /><br />";"2015.10.30-grails-re-create-controller-and-views-for-updated-domain-class.md"
"# Image Rotator<br /><br />I created a image scrolling script for a website. Below is the Javascript and HTML code to use it. Please leave the credits to me<br /><br /><br /><br />```var indexBannersNum = 0;<br /><br />var indexBanners = new Array();<br /><br />/*<br /><br />* IMAGE ROTATOR SCRIPT<br /><br />* CREATED BY KENNY R<br /><br />* HTTP://KRCOMPUTING.BLOGSPOT.COM<br /><br />* HTTP://WWW.BLACKBOXITECH.COM BLACKBOXITECH@GMAIL.COM<br /><br />*/<br /><br />function imageRotator(){<br /><br /><br /><br />//INDEXBANNERS[]=[IMAGE URL, ALTERNATE TEXT, WEBPAGE URL]<br /><br />indexBanners[0]=[""image1.jpg"",""Alternate Text"",""url.html""]<br /><br />indexBanners[1]=[""image2.jpg"",""Alternate Text"",""url.html""]<br /><br />indexBanners[2]=[""image3.jpg"",""Alternate Text"",""url.html""]<br /><br />indexBanners[3]=[""image4.jpg"",""Alternate Text"",""url.html""]<br /><br /><br /><br />document.getElementById(""image_reel"").innerHTML =<br /><br /> ""&lt;a href='"" + indexBanners[indexBannersNum][2] + ""'&gt;"" +<br /><br /> ""&lt;img src='nbcfc_images/"" + indexBanners[indexBannersNum][0] + ""' alt='"" + indexBanners[indexBannersNum][1] +<br /><br /> ""' style='border-width: 0px;' /&gt;"" +<br /><br /> ""&lt;/a&gt;"";<br /><br />if(indexBannersNum &gt;= (indexBanners.length-1)){<br /><br /> indexBannersNum = 0;<br /><br />}<br /><br />else{<br /><br /> indexBannersNum++;<br /><br />}<br /><br /><br /><br />//YOU MAY CHANGE THE DELAY. THE TIME IS IN MILLISECONDS. I.E. 6000 MILLISECONDS = 6 SECONDS<br /><br />setTimeout(""imageRotator();"",6000);<br /><br />}```<br /><br /><br /><br />Modify your opening body tag to include the text below.<br /><br /><br /><br />```onload=""imageRotator()""```<br /><br /><br /><br />Add the code below where you want the image to appear.<br /><br />```&lt;div id=""image_reel""&gt;<br /><br />&lt;!--<br /><br />IMAGE ROTATOR SCRIPT; CREATED BY KENNY R.;<br /><br />HTTP://KRCOMPUTING.BLOGSPOT.COM<br /><br />HTTP://WWW.BLACKBOXITECH.COM<br /><br />--&gt;<br /><br />&lt;a href=""url.html""&gt;&lt;img src=""image1.jpg"" alt=""Default Image"" /&gt;&lt;/a&gt;<br /><br />&lt;!--<br /><br />CHANGE THE IMAGE SOURCE AND ALTERNATE TEXT TO THE IMAGE THAT YOU ONE TO SHOW FOR INCOMPATIABLE BROWSERS. ALSO<br /><br />CHANGE THE URL TO MAKE THE DEFAULT PAGE YOU WANT TO LINK TOO.<br /><br />--&gt;<br /><br />&lt;/div&gt;<br />```<br /><br /><br />**Posted: 2015-10-30 20:32:35**<br /><br />**Updated: 2019-03-08 20:10:05**<br /><br />";"2015.10.30-image-rotator.md"
"# Migrate Drupal Installation from desktop to server<br /><br />Well it is very easy to migrate drupal site which you have in your computer using WAMP. Just need to follow the following steps.<br /><br /><br /><br />1&gt; You will have to upload all the files of drupal from your computer to your webspace using ftp client i.e filezilla or cuteftp etc…<br /><br />2&gt; Then login to cPanel &gt;&gt; go to Mysql databases &gt;&gt; create new database and database user and add database user in to database.<br /><br />3&gt;Create database backup of your local computer in .sql format.<br /><br />4&gt; Then go to phpmyadmin in cpanel and import .sql file in to the database that you have just created.<br /><br />5&gt; Here is the main important part now. You will have to edit following line in to settings.php file as specified below.<br /><br /><br /><br />$db_url = 'mysql://username:password@localhost/databasename';<br /><br /><br /><br />Source: http://www.servertechs.net/how-to-migrate-drupal-site-from-your-local-computer-to-the-server.html<br /><br />**Posted: 2015-10-30 20:33:09**<br /><br />**Updated: 2019-03-08 20:10:05**<br /><br />";"2015.10.30-migrate-drupal-installation-from-desktop-to-server.md"
"# Setup LDAP on Ubuntu 10.04<br /><br /><span style=""font-family: Arial, Helvetica, sans-serif;"">I attempted to set up and LDAP server on Ubuntu, but apparently I skipped a step or missed part of the instructions because I could not get it to work. After researching many websites, I was finally able to come up with a solution that got it to work. All of the instructions are based upon the use of a Linux command prompt (or terminal)</span><br /><br /><span style=""font-family: Arial, Helvetica, sans-serif;""><br /><br /></span><br /><br /><br /><br />* <span style=""background-color: white; color: #333333; line-height: 18px; text-align: left;""><span style=""font-family: Arial, Helvetica, sans-serif;"">Connect to your server</span></span><br />* <span style=""background-color: white; color: #333333; line-height: 18px; text-align: left;""><span style=""font-family: Arial, Helvetica, sans-serif;"">Enter </span></span><span style=""background-color: white; color: #333333; line-height: 18px; text-align: left;""><span style=""font-family: 'Courier New', Courier, monospace;"">sudo apt-get purge slapd</span><br /><br /><span style=""font-family: Arial, Helvetica, sans-serif;"">This will clear your existing slapd configuration if you have one.</span></span><br />* <span style=""background-color: white; text-align: left;""><span style=""color: #333333; font-family: Arial, Helvetica, sans-serif; line-height: 18px;"">Enter</span><span style=""font-family: 'Courier New', Courier, monospace;""><span style=""color: #333333; line-height: 18px;""> </span><span style=""color: #333333; line-height: 18px;"">sudo apt-get install slapd ldap-utils</span> <code style=""background-attachment: initial; background-clip: initial; background-image: initial; background-origin: initial; border-bottom-width: 0px; border-color: initial; border-image: initial; border-left-width: 0px; border-right-width: 0px; border-style: initial; border-top-width: 0px; color: #101010; line-height: 21px; margin-bottom: 0px; margin-left: 0px; margin-right: 0px; margin-top: 0px; outline-color: initial; outline-style: initial; outline-width: 0px; padding-bottom: 0px; padding-left: 0px; padding-right: 0px; padding-top: 0px; vertical-align: baseline;"">php5-ldap```<br /></span><br /><br /><span style=""font-family: Arial, Helvetica, sans-serif;""><span style=""color: #333333;""><span style=""line-height: 18px;"">This willre-installslapd with the initial configuration and install ldap-utils and php5-ldap packages if you do not already have them</span></span></span></span><br />* <span style=""font-family: Arial, Helvetica, sans-serif;""><span style=""line-height: 18px; text-align: left;""><span style=""color: #333333;"">A</span></span><span style=""color: #101010; line-height: 21px; text-align: left;"">ccept any dependencies necessary.</span></span><br />* <span style=""background-color: white; color: #333333; line-height: 18px; text-align: left;""><span style=""font-family: Arial, Helvetica, sans-serif;"">Copy the script located at http://www.blackboxitech.com/it_help/ldap_script.txt to your server. When saving the file, name it ldap_script.sh and save it in a directory that you have access. ( I don't know who initially created it, so I don't know who give credit to)</span></span><br /><li style=""text-align: left;""><span style=""color: #333333; font-family: Arial, Helvetica, sans-serif;""><span style=""line-height: 18px;"">Give the scriptexecutablepermissions by running the command</span></span> <span style=""background-color: white; color: #101010; line-height: 21px;""><span style=""font-family: 'Courier New', Courier, monospace;"">chmod u+x ldap_script.sh</span></span><br /><li style=""text-align: left;""><span style=""background-color: white; color: #101010; line-height: 21px;""><span style=""font-family: Arial, Helvetica, sans-serif;"">Edit the file look for and edit the following lines:<br /><br /><span style=""font-family: 'Courier New', Courier, monospace;"">passwd=pleaseeditme</span><br style=""font-family: 'Courier New', Courier, monospace;"" /><span style=""font-family: 'Courier New', Courier, monospace;"">dc1=pleaseeditme</span><br style=""font-family: 'Courier New', Courier, monospace;"" /><span style=""font-family: 'Courier New', Courier, monospace;"">dc2=pleaseeditme<br /><br /><br /><br />In my instance, I changed the lines to<br /><br />passwd=mypassword<br /><br />dc1=blackbox<br /><br />dc2=local</span></span></span><br /><li style=""text-align: left;""><span style=""background-color: white; color: #101010; line-height: 21px;""><span style=""font-family: Arial, Helvetica, sans-serif;"">If you wish, you may change the lines towards the end of the script so that the first user that is added, has all the necessary fields of your choosing. I chose to not modify the fields so that at least one user is added correctly.</span></span><br /><li style=""text-align: left;""><span style=""background-color: white; color: #101010; line-height: 21px;""><span style=""font-family: Arial, Helvetica, sans-serif;"">After you have finished making all of the changes, run the command </span><span style=""font-family: Times, 'Times New Roman', serif;""><span style=""background-attachment: initial; background-clip: initial; background-image: initial; background-origin: initial; border-bottom-width: 0px; border-color: initial; border-image: initial; border-left-width: 0px; border-right-width: 0px; border-style: initial; border-top-width: 0px; margin-bottom: 0px; margin-left: 0px; margin-right: 0px; margin-top: 0px; outline-color: initial; outline-style: initial; outline-width: 0px; padding-bottom: 0px; padding-left: 0px; padding-right: 0px; padding-top: 0px; vertical-align: baseline;"">sudo ./ldap_script</span> </span><span style=""font-family: Arial, Helvetica, sans-serif;"">You will see the script run and it may prompt you for your password.</span></span><br /><li style=""text-align: left;""><span style=""background-color: white; color: #101010; line-height: 21px;""><span style=""font-family: Arial, Helvetica, sans-serif;"">Enter the command</span> <span style=""font-family: 'Courier New', Courier, monospace;"">ldapsearch -x -h localhost -b ""dc=EXAMPLE,dc=COM"" ""(objectClass=*)""</span><span style=""font-family: Arial, Helvetica, sans-serif;""> where EXAMPLE and COM match the entries that you included in the file. You should see the results of your LDAP server.</span><br /><br /></span><br /><br /><div style=""text-align: left;""><span style=""color: #333333; font-family: Arial, Helvetica, sans-serif;""><span style=""line-height: 18px;""><br /><br /></span></span><div style=""text-align: left;""><span style=""color: #333333; font-family: Arial, Helvetica, sans-serif;""><span style=""line-height: 18px;"">Information Sources:</span></span><div style=""text-align: left;""><a href=""http://www.ghacks.net/2010/08/31/set-up-your-ldap-server-on-ubuntu-10-04/"">http://www.ghacks.net/2010/08/31/set-up-your-ldap-server-on-ubuntu-10-04/</a> <div style=""text-align: left;""><a href=""http://pastebin.com/qGk9CzQ9"">http://pastebin.com/qGk9CzQ9</a> <div style=""text-align: left;""><a href=""https://bugs.launchpad.net/ubuntu/+source/openldap/+bug/477257"">https://bugs.launchpad.net/ubuntu/+source/openldap/+bug/477257</a><br /><br />**Posted: 2015-10-30 20:35:28**<br /><br />**Updated: 2019-03-08 20:10:05**<br /><br />";"2015.10.30-setup-ldap-on-ubuntu-10.04.md"
